{
  "authority_defaults": {
    "may_authorize_execution": false,
    "may_establish_consent": false,
    "may_establish_mutuality": false,
    "may_establish_truth": false,
    "may_grant_permissions": false
  },
  "profile": "temporal-relationship-semantics-v0.1",
  "relation_policies": {
    "delegated_to": {
      "authority_sensitive": true,
      "cardinality": "many",
      "mutuality": "not_required"
    },
    "friend_of": {
      "authority_sensitive": false,
      "cardinality": "many",
      "mutuality": "required"
    },
    "reports_to": {
      "authority_sensitive": false,
      "cardinality": "one",
      "mutuality": "not_required"
    },
    "trusts": {
      "authority_sensitive": false,
      "cardinality": "many",
      "mutuality": "not_required"
    },
    "works_at": {
      "authority_sensitive": false,
      "cardinality": "many",
      "mutuality": "not_required"
    }
  },
  "schema_version": "temporal-relationship-semantics-fixtures-v0.1",
  "vectors": [
    {
      "description": "Two current targets for a cardinality-one relation cannot resolve by write order.",
      "edges": [
        {
          "asserted_by": "system:hr-a",
          "confirmed_by": [
            "system:hr-a"
          ],
          "directionality": "directed",
          "edge_id": "edge:manager-x",
          "evidence_kind": "directory",
          "evidence_refs": [
            "directory:a"
          ],
          "promotion_authorization_ref": null,
          "ratification_ref": "hr:a",
          "relation_type": "reports_to",
          "scope": "group",
          "semantic_weight": 1.0,
          "source_entity_id": "person:dev",
          "source_scope": "group",
          "status": "RATIFIED",
          "supersedes": null,
          "target_entity_id": "person:manager-x",
          "valid_from": "2026-06-01T00:00:00Z",
          "valid_until": null
        },
        {
          "asserted_by": "system:hr-b",
          "confirmed_by": [
            "system:hr-b"
          ],
          "directionality": "directed",
          "edge_id": "edge:manager-y",
          "evidence_kind": "directory",
          "evidence_refs": [
            "directory:b"
          ],
          "promotion_authorization_ref": null,
          "ratification_ref": "hr:b",
          "relation_type": "reports_to",
          "scope": "group",
          "semantic_weight": 1.0,
          "source_entity_id": "person:dev",
          "source_scope": "group",
          "status": "RATIFIED",
          "supersedes": null,
          "target_entity_id": "person:manager-y",
          "valid_from": "2026-06-02T00:00:00Z",
          "valid_until": null
        }
      ],
      "expected": {
        "decision": "CONFLICTED",
        "historical_edge_ids": [],
        "reason_codes": [
          "UNRESOLVED_CURRENT_CONTRADICTION"
        ],
        "selected_edge_ids": [],
        "suppressed_edge_ids": []
      },
      "fixture_id": "exclusive_current_edges_conflicted",
      "query": {
        "now": "2026-06-25T12:00:00Z",
        "relation_type": "reports_to",
        "requires_mutual": false,
        "scope_precedence": [
          "group",
          "private",
          "global"
        ],
        "source_entity_id": "person:dev"
      }
    },
    {
      "description": "A disputed relationship is retained but cannot be presented as current settled context.",
      "edges": [
        {
          "asserted_by": "agent:a",
          "confirmed_by": [
            "agent:a"
          ],
          "directionality": "directed",
          "edge_id": "edge:disputed-trust",
          "evidence_kind": "interaction_assessment",
          "evidence_refs": [
            "episode:41",
            "counterevidence:7"
          ],
          "promotion_authorization_ref": null,
          "ratification_ref": null,
          "relation_type": "trusts",
          "scope": "group",
          "semantic_weight": 0.7,
          "source_entity_id": "agent:a",
          "source_scope": "group",
          "status": "DISPUTED",
          "supersedes": null,
          "target_entity_id": "agent:b",
          "valid_from": "2026-06-10T00:00:00Z",
          "valid_until": null
        }
      ],
      "expected": {
        "decision": "ABSTAIN",
        "historical_edge_ids": [],
        "reason_codes": [
          "RELATIONSHIP_DISPUTED"
        ],
        "selected_edge_ids": [],
        "suppressed_edge_ids": [
          "edge:disputed-trust"
        ]
      },
      "fixture_id": "disputed_trust_edge_abstains",
      "query": {
        "now": "2026-06-25T12:00:00Z",
        "relation_type": "trusts",
        "requires_mutual": false,
        "scope_precedence": [
          "group",
          "private",
          "global"
        ],
        "source_entity_id": "agent:a"
      }
    }
  ]
}
