{
  "authority_defaults": {
    "may_authorize_execution": false,
    "may_establish_consent": false,
    "may_establish_mutuality": false,
    "may_establish_truth": false,
    "may_grant_permissions": false
  },
  "profile": "temporal-relationship-semantics-v0.1",
  "relation_policies": {
    "delegated_to": {
      "authority_sensitive": true,
      "cardinality": "many",
      "mutuality": "not_required"
    },
    "friend_of": {
      "authority_sensitive": false,
      "cardinality": "many",
      "mutuality": "required"
    },
    "reports_to": {
      "authority_sensitive": false,
      "cardinality": "one",
      "mutuality": "not_required"
    },
    "trusts": {
      "authority_sensitive": false,
      "cardinality": "many",
      "mutuality": "not_required"
    },
    "works_at": {
      "authority_sensitive": false,
      "cardinality": "many",
      "mutuality": "not_required"
    }
  },
  "schema_version": "temporal-relationship-semantics-fixtures-v0.1",
  "vectors": [
    {
      "description": "A private relationship edge cannot become global without explicit promotion authority.",
      "edges": [
        {
          "asserted_by": "person:alex",
          "confirmed_by": [
            "person:alex",
            "person:maria"
          ],
          "directionality": "symmetric",
          "edge_id": "edge:global-friendship-promotion",
          "evidence_kind": "participant_confirmation",
          "evidence_refs": [
            "message:alex-102",
            "message:maria-88"
          ],
          "promotion_authorization_ref": null,
          "ratification_ref": "ratification:friendship-1",
          "relation_type": "friend_of",
          "scope": "global",
          "semantic_weight": 1.0,
          "source_entity_id": "person:alex",
          "source_scope": "private",
          "status": "RATIFIED",
          "supersedes": null,
          "target_entity_id": "person:maria",
          "valid_from": "2026-06-25T10:00:00Z",
          "valid_until": null
        }
      ],
      "expected": {
        "decision": "REJECT",
        "historical_edge_ids": [],
        "reason_codes": [
          "SCOPE_PROMOTION_UNAUTHORIZED"
        ],
        "selected_edge_ids": [],
        "suppressed_edge_ids": [
          "edge:global-friendship-promotion"
        ]
      },
      "fixture_id": "unauthorized_scope_promotion_rejected",
      "query": {
        "now": "2026-06-25T12:00:00Z",
        "relation_type": "friend_of",
        "requires_mutual": true,
        "scope_precedence": [
          "private",
          "group",
          "global"
        ],
        "source_entity_id": "person:alex"
      }
    }
  ]
}
